{
  "schema_version": "1.0.0",
  "context_type": "aaa_game",
  "context_status": "active",
  "delivery_claim_ceiling": "vertical_slice",
  "documentation_profile": "full_game",
  "project_intent": {
    "one_sentence_goal": "Criar um belt scroller AAA autoral (capoeira + muay thai nas ruas costeiras do Brasil) que dispute com Streets of Rage 2 em game feel e direcao visual.",
    "success_definition": "First playable slice: uma cena de rua jogavel com 1 heroi, 2 tipos de inimigo, combo basico, hitstop e evidencia no BlastEm a 60fps.",
    "non_goals": [
      "Copiar IP protegida (SOR2 e referencia de qualidade, nao de conteudo)",
      "Multiplos cenarios antes do slice aprovado",
      "Modo 2 jogadores no primeiro slice"
    ]
  },
  "blocking_policy": {
    "levels": [
      "blocking",
      "phase_blocking",
      "recommended",
      "optional",
      "not_applicable"
    ],
    "documents": [
      {
        "path": "doc/project_context_manifest.json",
        "role": "classificacao do contexto de trabalho",
        "requirement": "blocking",
        "required_for_contexts": [
          "aaa_game",
          "technical_demo",
          "exercise",
          "game_review",
          "consulting"
        ]
      },
      {
        "path": "doc/00-project-brief.md",
        "role": "one-pager, pilares, escopo e nao-escopo",
        "requirement": "blocking",
        "required_for_contexts": [
          "aaa_game",
          "technical_demo",
          "exercise"
        ]
      },
      {
        "path": "doc/11-gdd.md",
        "role": "design jogavel, loop, regras e fantasia",
        "requirement": "blocking",
        "required_for_contexts": [
          "aaa_game"
        ]
      },
      {
        "path": "doc/15-tdd.md",
        "role": "arquitetura tecnica executavel e orcamentos",
        "requirement": "blocking",
        "required_for_contexts": [
          "aaa_game"
        ]
      },
      {
        "path": "doc/13-spec-cenas.md",
        "role": "contrato de cenas, tecnicas e evidencia",
        "requirement": "blocking",
        "required_for_contexts": [
          "aaa_game",
          "technical_demo"
        ]
      },
      {
        "path": "doc/14-plano-de-provas-qa.md",
        "role": "plano de validacao proporcional ao contexto",
        "requirement": "blocking",
        "required_for_contexts": [
          "aaa_game",
          "technical_demo"
        ]
      },
      {
        "path": "doc/16-ldd.md",
        "role": "layout, ritmo, progressao e navegacao de fases",
        "requirement": "phase_blocking",
        "required_for_contexts": [
          "aaa_game"
        ]
      },
      {
        "path": "doc/17-audio-design.md",
        "role": "direcao musical, SFX e integracao com gameplay",
        "requirement": "phase_blocking",
        "required_for_contexts": [
          "aaa_game"
        ]
      },
      {
        "path": "doc/18-asset-register.json",
        "role": "inventario vivo de assets, owners e status",
        "requirement": "blocking",
        "required_for_contexts": [
          "aaa_game",
          "technical_demo"
        ]
      },
      {
        "path": "doc/19-roadmap-risk-register.md",
        "role": "milestones, riscos, cortes e decisoes de producao",
        "requirement": "blocking",
        "required_for_contexts": [
          "aaa_game"
        ]
      },
      {
        "path": "doc/20-release-marketing-legal.md",
        "role": "release, marca, localizacao, loja e direitos",
        "requirement": "phase_blocking",
        "required_for_contexts": [
          "aaa_game"
        ]
      },
      {
        "path": "doc/21-review-consulting-context.md",
        "role": "escopo de review ou consultoria e limites de parecer",
        "requirement": "blocking",
        "required_for_contexts": [
          "game_review",
          "consulting"
        ]
      },
      {
        "path": "doc/10-memory-bank.md",
        "role": "estado operacional real",
        "requirement": "blocking",
        "required_for_contexts": [
          "aaa_game",
          "technical_demo",
          "exercise",
          "game_review",
          "consulting"
        ]
      },
      {
        "path": "doc/changelog/changelog.md",
        "role": "registro cronologico de mudancas",
        "requirement": "blocking",
        "required_for_contexts": [
          "aaa_game",
          "technical_demo",
          "exercise"
        ]
      }
    ]
  },
  "context_decision_record": {
    "selected_by": "human",
    "rationale": "Usuario escolheu explicitamente criar novo jogo com especializacao brawler_belt_scroll via menu de sessao em 2026-07-03.",
    "evidence_or_prompt": "Resposta do usuario na sessao de 2026-07-03: alvo=Criar novo jogo; genero=brawler_belt_scroll (registry ativo).",
    "human_confirmation_required_for_mode_change": true,
    "last_reviewed_at": "2026-07-03"
  }
}