{
  "schema_version": "1.0.0",
  "context_type": "technical_demo",
  "context_status": "active",
  "delivery_claim_ceiling": "technical_demo",
  "documentation_profile": "demo",
  "project_intent": {
    "one_sentence_goal": "Converter o prototipo de mapa virtual do Shadow Dancer para SGDK 2.11 com runtime seguro e workflow rastreavel.",
    "success_definition": "A copia compila pelo wrapper, valida recursos e deixa a ROM pronta para teste em BlastEm sem heap no hot loop ou DMA imediato no callback.",
    "non_goals": [
      "Promover o prototipo a jogo completo ou release",
      "Alegar gameplay, audio ou 60 fps sem evidencia de emulador",
      "Adicionar assets ou sistemas fora do mapa virtual e do jogador atuais"
    ]
  },
  "blocking_policy": {
    "levels": [
      "blocking",
      "phase_blocking",
      "recommended",
      "optional",
      "not_applicable"
    ],
    "documents": [
      {
        "path": "doc/project_context_manifest.json",
        "role": "classificacao do contexto de trabalho",
        "requirement": "blocking",
        "required_for_contexts": [
          "aaa_game",
          "technical_demo",
          "exercise",
          "game_review",
          "consulting"
        ]
      },
      {
        "path": "doc/00-project-brief.md",
        "role": "one-pager, pilares, escopo e nao-escopo",
        "requirement": "blocking",
        "required_for_contexts": [
          "aaa_game",
          "technical_demo",
          "exercise"
        ]
      },
      {
        "path": "doc/11-gdd.md",
        "role": "design jogavel, loop, regras e fantasia",
        "requirement": "blocking",
        "required_for_contexts": [
          "aaa_game"
        ]
      },
      {
        "path": "doc/15-tdd.md",
        "role": "arquitetura tecnica executavel e orcamentos",
        "requirement": "blocking",
        "required_for_contexts": [
          "aaa_game"
        ]
      },
      {
        "path": "doc/13-spec-cenas.md",
        "role": "contrato de cenas, tecnicas e evidencia",
        "requirement": "blocking",
        "required_for_contexts": [
          "aaa_game",
          "technical_demo"
        ]
      },
      {
        "path": "doc/14-plano-de-provas-qa.md",
        "role": "plano de validacao proporcional ao contexto",
        "requirement": "blocking",
        "required_for_contexts": [
          "aaa_game",
          "technical_demo"
        ]
      },
      {
        "path": "doc/16-ldd.md",
        "role": "layout, ritmo, progressao e navegacao de fases",
        "requirement": "phase_blocking",
        "required_for_contexts": [
          "aaa_game"
        ]
      },
      {
        "path": "doc/17-audio-design.md",
        "role": "direcao musical, SFX e integracao com gameplay",
        "requirement": "phase_blocking",
        "required_for_contexts": [
          "aaa_game"
        ]
      },
      {
        "path": "doc/18-asset-register.json",
        "role": "inventario vivo de assets, owners e status",
        "requirement": "blocking",
        "required_for_contexts": [
          "aaa_game",
          "technical_demo"
        ]
      },
      {
        "path": "doc/19-roadmap-risk-register.md",
        "role": "milestones, riscos, cortes e decisoes de producao",
        "requirement": "blocking",
        "required_for_contexts": [
          "aaa_game"
        ]
      },
      {
        "path": "doc/20-release-marketing-legal.md",
        "role": "release, marca, localizacao, loja e direitos",
        "requirement": "phase_blocking",
        "required_for_contexts": [
          "aaa_game"
        ]
      },
      {
        "path": "doc/21-review-consulting-context.md",
        "role": "escopo de review ou consultoria e limites de parecer",
        "requirement": "blocking",
        "required_for_contexts": [
          "game_review",
          "consulting"
        ]
      },
      {
        "path": "doc/10-memory-bank.md",
        "role": "estado operacional real",
        "requirement": "blocking",
        "required_for_contexts": [
          "aaa_game",
          "technical_demo",
          "exercise",
          "game_review",
          "consulting"
        ]
      },
      {
        "path": "doc/changelog/changelog.md",
        "role": "registro cronologico de mudancas",
        "requirement": "blocking",
        "required_for_contexts": [
          "aaa_game",
          "technical_demo",
          "exercise"
        ]
      }
    ]
  },
  "context_decision_record": {
    "selected_by": "agent_inferred",
    "rationale": "O codigo original e um experimento funcional de mapa virtual, nao um jogo completo com escopo de release.",
    "evidence_or_prompt": "informacoes.txt e runtime original com MAP_create, tile cache e um jogador.",
    "human_confirmation_required_for_mode_change": true,
    "last_reviewed_at": "2026-09-21T03:00:00Z"
  }
}
